 00:00:00.071558 IP yali.mythic-beasts.com.https > mangole.dcs.gla.ac.uk.52088: Flags [P.], seq 1369:2737, ack 324, win 507, options [nop,nop,TS val 1395313687 ecr 3652396244], length 1368
 00:00:00.071569 IP yali.mythic-beasts.com.https > mangole.dcs.gla.ac.uk.52088: Flags [P.], seq 2737:3648, ack 324, win 507, options [nop,nop,TS val 1395313687 ecr 3652396244], length 911
 00:00:00.091079 IP yali.mythic-beasts.com.https > mangole.dcs.gla.ac.uk.52088: Flags [.], ack 330, win 507, options [nop,nop,TS val 1395313707 ecr 3652396305], length 0
 00:00:00.091290 IP yali.mythic-beasts.com.https > mangole.dcs.gla.ac.uk.52088: Flags [.], ack 388, win 507, options [nop,nop,TS val 1395313707 ecr 3652396305], length 0
 00:00:00.091507 IP yali.mythic-beasts.com.https > mangole.dcs.gla.ac.uk.52088: Flags [P.], seq 3648:3727, ack 388, win 507, options [nop,nop,TS val 1395313708 ecr 3652396305], length 79
 00:00:00.091782 IP yali.mythic-beasts.com.https > mangole.dcs.gla.ac.uk.52088: Flags [P.], seq 3727:3806, ack 388, win 507, options [nop,nop,TS val 1395313708 ecr 3652396305], length 79
 00:00:00.094765 IP yali.mythic-beasts.com.https > mangole.dcs.gla.ac.uk.52088: Flags [.], seq 3806:5174, ack 526, win 506, options [nop,nop,TS val 1395313711 ecr 3652396305], length 1368
 00:00:00.094767 IP yali.mythic-beasts.com.https > mangole.dcs.gla.ac.uk.52088: Flags [P.], seq 5174:6542, ack 526, win 506, options [nop,nop,TS val 1395313711 ecr 3652396305], length 1368
 00:00:00.094768 IP yali.mythic-beasts.com.https > mangole.dcs.gla.ac.uk.52088: Flags [.], seq 6542:7910, ack 526, win 506, options [nop,nop,TS val 1395313711 ecr 3652396305], length 1368
 00:00:00.094769 IP yali.mythic-beasts.com.https > mangole.dcs.gla.ac.uk.52088: Flags [P.], seq 7910:9278, ack 526, win 506, options [nop,nop,TS val 1395313711 ecr 3652396305], length 1368
 00:00:00.094770 IP yali.mythic-beasts.com.https > mangole.dcs.gla.ac.uk.52088: Flags [.], seq 9278:10646, ack 526, win 506, options [nop,nop,TS val 1395313711 ecr 3652396305], length 1368
 00:00:00.094771 IP yali.mythic-beasts.com.https > mangole.dcs.gla.ac.uk.52088: Flags [P.], seq 10646:12014, ack 526, win 506, options [nop,nop,TS val 1395313711 ecr 3652396305], length 1368
 00:00:00.094772 IP yali.mythic-beasts.com.https > mangole.dcs.gla.ac.uk.52088: Flags [.], seq 12014:13382, ack 526, win 506, options [nop,nop,TS val 1395313711 ecr 3652396305], length 1368
 00:00:00.094773 IP yali.mythic-beasts.com.https > mangole.dcs.gla.ac.uk.52088: Flags [P.], seq 13382:14750, ack 526, win 506, options [nop,nop,TS val 1395313711 ecr 3652396305], length 1368
 00:00:00.106344 IP yali.mythic-beasts.com.https > mangole.dcs.gla.ac.uk.52088: Flags [.], seq 14750:16118, ack 526, win 506, options [nop,nop,TS val 1395313723 ecr 3652396321], length 1368
 00:00:00.106345 IP yali.mythic-beasts.com.https > mangole.dcs.gla.ac.uk.52088: Flags [P.], seq 16118:17486, ack 526, win 506, options [nop,nop,TS val 1395313723 ecr 3652396321], length 1368
 00:00:00.106345 IP yali.mythic-beasts.com.https > mangole.dcs.gla.ac.uk.52088: Flags [.], seq 17486:18854, ack 526, win 506, options [nop,nop,TS val 1395313723 ecr 3652396322], length 1368
 00:00:00.106346 IP yali.mythic-beasts.com.https > mangole.dcs.gla.ac.uk.52088: Flags [P.], seq 18854:20222, ack 526, win 506, options [nop,nop,TS val 1395313723 ecr 3652396322], length 1368
 00:00:00.108385 IP yali.mythic-beasts.com.https > mangole.dcs.gla.ac.uk.52088: Flags [.], seq 20222:21590, ack 526, win 506, options [nop,nop,TS val 1395313726 ecr 3652396324], length 1368
 00:00:00.108387 IP yali.mythic-beasts.com.https > mangole.dcs.gla.ac.uk.52088: Flags [P.], seq 21590:22958, ack 526, win 506, options [nop,nop,TS val 1395313726 ecr 3652396324], length 1368
 00:00:00.108388 IP yali.mythic-beasts.com.https > mangole.dcs.gla.ac.uk.52088: Flags [.], seq 22958:24326, ack 526, win 506, options [nop,nop,TS val 1395313726 ecr 3652396324], length 1368
 00:00:00.108389 IP yali.mythic-beasts.com.https > mangole.dcs.gla.ac.uk.52088: Flags [P.], seq 24326:25694, ack 526, win 506, options [nop,nop,TS val 1395313726 ecr 3652396324], length 1368
 00:00:00.108390 IP yali.mythic-beasts.com.https > mangole.dcs.gla.ac.uk.52088: Flags [.], seq 25694:27062, ack 526, win 506, options [nop,nop,TS val 1395313726 ecr 3652396324], length 1368
 00:00:00.108391 IP yali.mythic-beasts.com.https > mangole.dcs.gla.ac.uk.52088: Flags [P.], seq 27062:28430, ack 526, win 506, options [nop,nop,TS val 1395313726 ecr 3652396324], length 1368
 00:00:00.108716 IP yali.mythic-beasts.com.https > mangole.dcs.gla.ac.uk.52088: Flags [.], seq 28430:29798, ack 526, win 506, options [nop,nop,TS val 1395313726 ecr 3652396324], length 1368
 00:00:00.108718 IP yali.mythic-beasts.com.https > mangole.dcs.gla.ac.uk.52088: Flags [P.], seq 29798:31166, ack 526, win 506, options [nop,nop,TS val 1395313726 ecr 3652396324], length 1368
 00:00:00.108719 IP yali.mythic-beasts.com.https > mangole.dcs.gla.ac.uk.52088: Flags [.], seq 31166:32534, ack 526, win 506, options [nop,nop,TS val 1395313726 ecr 3652396324], length 1368
 00:00:00.108720 IP yali.mythic-beasts.com.https > mangole.dcs.gla.ac.uk.52088: Flags [P.], seq 32534:33902, ack 526, win 506, options [nop,nop,TS val 1395313726 ecr 3652396324], length 1368
 00:00:00.108721 IP yali.mythic-beasts.com.https > mangole.dcs.gla.ac.uk.52088: Flags [.], seq 33902:35270, ack 526, win 506, options [nop,nop,TS val 1395313726 ecr 3652396324], length 1368
 00:00:00.108722 IP yali.mythic-beasts.com.https > mangole.dcs.gla.ac.uk.52088: Flags [P.], seq 35270:36638, ack 526, win 506, options [nop,nop,TS val 1395313726 ecr 3652396324], length 1368
 00:00:00.108723 IP yali.mythic-beasts.com.https > mangole.dcs.gla.ac.uk.52088: Flags [.], seq 36638:38006, ack 526, win 506, options [nop,nop,TS val 1395313726 ecr 3652396324], length 1368
 00:00:00.108724 IP yali.mythic-beasts.com.https > mangole.dcs.gla.ac.uk.52088: Flags [P.], seq 38006:39374, ack 526, win 506, options [nop,nop,TS val 1395313726 ecr 3652396324], length 1368
 00:00:00.108725 IP yali.mythic-beasts.com.https > mangole.dcs.gla.ac.uk.52088: Flags [.], seq 39374:40742, ack 526, win 506, options [nop,nop,TS val 1395313726 ecr 3652396324], length 1368
 00:00:00.108726 IP yali.mythic-beasts.com.https > mangole.dcs.gla.ac.uk.52088: Flags [P.], seq 40742:42110, ack 526, win 506, options [nop,nop,TS val 1395313726 ecr 3652396324], length 1368
 00:00:00.120086 IP yali.mythic-beasts.com.https > mangole.dcs.gla.ac.uk.52088: Flags [.], seq 42110:43478, ack 526, win 506, options [nop,nop,TS val 1395313737 ecr 3652396336], length 1368
 00:00:00.120087 IP yali.mythic-beasts.com.https > mangole.dcs.gla.ac.uk.52088: Flags [.], seq 43478:44846, ack 526, win 506, options [nop,nop,TS val 1395313737 ecr 3652396336], length 1368
 00:00:00.120088 IP yali.mythic-beasts.com.https > mangole.dcs.gla.ac.uk.52088: Flags [P.], seq 44846:46214, ack 526, win 506, options [nop,nop,TS val 1395313737 ecr 3652396336], length 1368
 00:00:00.120089 IP yali.mythic-beasts.com.https > mangole.dcs.gla.ac.uk.52088: Flags [.], seq 46214:47582, ack 526, win 506, options [nop,nop,TS val 1395313737 ecr 3652396336], length 1368
 00:00:00.120090 IP yali.mythic-beasts.com.https > mangole.dcs.gla.ac.uk.52088: Flags [.], seq 47582:48950, ack 526, win 506, options [nop,nop,TS val 1395313737 ecr 3652396336], length 1368
 00:00:00.120091 IP yali.mythic-beasts.com.https > mangole.dcs.gla.ac.uk.52088: Flags [P.], seq 48950:50318, ack 526, win 506, options [nop,nop,TS val 1395313737 ecr 3652396336], length 1368
 00:00:00.120258 IP yali.mythic-beasts.com.https > mangole.dcs.gla.ac.uk.52088: Flags [.], seq 50318:51686, ack 526, win 506, options [nop,nop,TS val 1395313738 ecr 3652396336], length 1368
 00:00:00.120259 IP yali.mythic-beasts.com.https > mangole.dcs.gla.ac.uk.52088: Flags [P.], seq 51686:53054, ack 526, win 506, options [nop,nop,TS val 1395313738 ecr 3652396336], length 1368
 00:00:00.121921 IP yali.mythic-beasts.com.https > mangole.dcs.gla.ac.uk.52088: Flags [.], seq 53054:54422, ack 526, win 506, options [nop,nop,TS val 1395313739 ecr 3652396338], length 1368
 00:00:00.121922 IP yali.mythic-beasts.com.https > mangole.dcs.gla.ac.uk.52088: Flags [.], seq 54422:55790, ack 526, win 506, options [nop,nop,TS val 1395313739 ecr 3652396338], length 1368
 00:00:00.121923 IP yali.mythic-beasts.com.https > mangole.dcs.gla.ac.uk.52088: Flags [.], seq 55790:57158, ack 526, win 506, options [nop,nop,TS val 1395313739 ecr 3652396338], length 1368
 00:00:00.121924 IP yali.mythic-beasts.com.https > mangole.dcs.gla.ac.uk.52088: Flags [P.], seq 57158:58526, ack 526, win 506, options [nop,nop,TS val 1395313739 ecr 3652396338], length 1368
 00:00:00.121925 IP yali.mythic-beasts.com.https > mangole.dcs.gla.ac.uk.52088: Flags [.], seq 58526:59894, ack 526, win 506, options [nop,nop,TS val 1395313739 ecr 3652396338], length 1368
 00:00:00.122113 IP yali.mythic-beasts.com.https > mangole.dcs.gla.ac.uk.52088: Flags [.], seq 59894:61262, ack 526, win 506, options [nop,nop,TS val 1395313739 ecr 3652396338], length 1368
 00:00:00.122570 IP yali.mythic-beasts.com.https > mangole.dcs.gla.ac.uk.52088: Flags [.], seq 61262:62630, ack 526, win 506, options [nop,nop,TS val 1395313739 ecr 3652396338], length 1368
 00:00:00.122571 IP yali.mythic-beasts.com.https > mangole.dcs.gla.ac.uk.52088: Flags [P.], seq 62630:63998, ack 526, win 506, options [nop,nop,TS val 1395313739 ecr 3652396338], length 1368
 00:00:00.122572 IP yali.mythic-beasts.com.https > mangole.dcs.gla.ac.uk.52088: Flags [.], seq 63998:65366, ack 526, win 506, options [nop,nop,TS val 1395313739 ecr 3652396338], length 1368
 00:00:00.122573 IP yali.mythic-beasts.com.https > mangole.dcs.gla.ac.uk.52088: Flags [.], seq 65366:66734, ack 526, win 506, options [nop,nop,TS val 1395313739 ecr 3652396338], length 1368
 00:00:00.122574 IP yali.mythic-beasts.com.https > mangole.dcs.gla.ac.uk.52088: Flags [.], seq 66734:68102, ack 526, win 506, options [nop,nop,TS val 1395313739 ecr 3652396338], length 1368
 00:00:00.122575 IP yali.mythic-beasts.com.https > mangole.dcs.gla.ac.uk.52088: Flags [P.], seq 68102:69470, ack 526, win 506, options [nop,nop,TS val 1395313739 ecr 3652396338], length 1368
 00:00:00.122716 IP yali.mythic-beasts.com.https > mangole.dcs.gla.ac.uk.52088: Flags [.], seq 69470:70838, ack 526, win 506, options [nop,nop,TS val 1395313739 ecr 3652396338], length 1368
 00:00:00.122717 IP yali.mythic-beasts.com.https > mangole.dcs.gla.ac.uk.52088: Flags [.], seq 70838:72206, ack 526, win 506, options [nop,nop,TS val 1395313739 ecr 3652396338], length 1368
 00:00:00.122718 IP yali.mythic-beasts.com.https > mangole.dcs.gla.ac.uk.52088: Flags [.], seq 72206:73574, ack 526, win 506, options [nop,nop,TS val 1395313739 ecr 3652396338], length 1368
 00:00:00.122719 IP yali.mythic-beasts.com.https > mangole.dcs.gla.ac.uk.52088: Flags [.], seq 73574:74942, ack 526, win 506, options [nop,nop,TS val 1395313739 ecr 3652396338], length 1368
 00:00:00.122719 IP yali.mythic-beasts.com.https > mangole.dcs.gla.ac.uk.52088: Flags [P.], seq 74942:76310, ack 526, win 506, options [nop,nop,TS val 1395313739 ecr 3652396338], length 1368
 00:00:00.122720 IP yali.mythic-beasts.com.https > mangole.dcs.gla.ac.uk.52088: Flags [.], seq 76310:77678, ack 526, win 506, options [nop,nop,TS val 1395313739 ecr 3652396338], length 1368
 00:00:00.122721 IP yali.mythic-beasts.com.https > mangole.dcs.gla.ac.uk.52088: Flags [.], seq 77678:79046, ack 526, win 506, options [nop,nop,TS val 1395313739 ecr 3652396338], length 1368
 00:00:00.122722 IP yali.mythic-beasts.com.https > mangole.dcs.gla.ac.uk.52088: Flags [.], seq 79046:80414, ack 526, win 506, options [nop,nop,TS val 1395313739 ecr 3652396338], length 1368
 00:00:00.122723 IP yali.mythic-beasts.com.https > mangole.dcs.gla.ac.uk.52088: Flags [.], seq 80414:81782, ack 526, win 506, options [nop,nop,TS val 1395313739 ecr 3652396338], length 1368
 00:00:00.122723 IP yali.mythic-beasts.com.https > mangole.dcs.gla.ac.uk.52088: Flags [P.], seq 81782:83150, ack 526, win 506, options [nop,nop,TS val 1395313739 ecr 3652396338], length 1368
 00:00:00.122724 IP yali.mythic-beasts.com.https > mangole.dcs.gla.ac.uk.52088: Flags [.], seq 83150:84518, ack 526, win 506, options [nop,nop,TS val 1395313739 ecr 3652396338], length 1368
 00:00:00.122725 IP yali.mythic-beasts.com.https > mangole.dcs.gla.ac.uk.52088: Flags [.], seq 84518:85886, ack 526, win 506, options [nop,nop,TS val 1395313739 ecr 3652396338], length 1368
 00:00:00.122726 IP yali.mythic-beasts.com.https > mangole.dcs.gla.ac.uk.52088: Flags [.], seq 85886:87254, ack 526, win 506, options [nop,nop,TS val 1395313739 ecr 3652396338], length 1368
 00:00:00.122726 IP yali.mythic-beasts.com.https > mangole.dcs.gla.ac.uk.52088: Flags [.], seq 87254:88622, ack 526, win 506, options [nop,nop,TS val 1395313739 ecr 3652396338], length 1368
 00:00:00.122727 IP yali.mythic-beasts.com.https > mangole.dcs.gla.ac.uk.52088: Flags [P.], seq 88622:89990, ack 526, win 506, options [nop,nop,TS val 1395313739 ecr 3652396338], length 1368
 00:00:00.122728 IP yali.mythic-beasts.com.https > mangole.dcs.gla.ac.uk.52088: Flags [.], seq 89990:91358, ack 526, win 506, options [nop,nop,TS val 1395313740 ecr 3652396338], length 1368
 00:00:00.122831 IP yali.mythic-beasts.com.https > mangole.dcs.gla.ac.uk.52088: Flags [.], seq 91358:92726, ack 526, win 506, options [nop,nop,TS val 1395313740 ecr 3652396338], length 1368
 00:00:00.122832 IP yali.mythic-beasts.com.https > mangole.dcs.gla.ac.uk.52088: Flags [.], seq 92726:94094, ack 526, win 506, options [nop,nop,TS val 1395313740 ecr 3652396338], length 1368
 00:00:00.122832 IP yali.mythic-beasts.com.https > mangole.dcs.gla.ac.uk.52088: Flags [.], seq 94094:95462, ack 526, win 506, options [nop,nop,TS val 1395313740 ecr 3652396338], length 1368
 00:00:00.122833 IP yali.mythic-beasts.com.https > mangole.dcs.gla.ac.uk.52088: Flags [P.], seq 95462:96830, ack 526, win 506, options [nop,nop,TS val 1395313740 ecr 3652396338], length 1368
 00:00:00.133872 IP yali.mythic-beasts.com.https > mangole.dcs.gla.ac.uk.52088: Flags [.], seq 96830:98198, ack 526, win 506, options [nop,nop,TS val 1395313751 ecr 3652396350], length 1368
 00:00:00.133874 IP yali.mythic-beasts.com.https > mangole.dcs.gla.ac.uk.52088: Flags [.], seq 98198:99566, ack 526, win 506, options [nop,nop,TS val 1395313751 ecr 3652396350], length 1368
 00:00:00.133875 IP yali.mythic-beasts.com.https > mangole.dcs.gla.ac.uk.52088: Flags [.], seq 99566:100934, ack 526, win 506, options [nop,nop,TS val 1395313751 ecr 3652396350], length 1368
 00:00:00.133876 IP yali.mythic-beasts.com.https > mangole.dcs.gla.ac.uk.52088: Flags [.], seq 100934:102302, ack 526, win 506, options [nop,nop,TS val 1395313751 ecr 3652396350], length 1368
 00:00:00.133877 IP yali.mythic-beasts.com.https > mangole.dcs.gla.ac.uk.52088: Flags [.], seq 102302:103670, ack 526, win 506, options [nop,nop,TS val 1395313751 ecr 3652396350], length 1368
 00:00:00.133878 IP yali.mythic-beasts.com.https > mangole.dcs.gla.ac.uk.52088: Flags [P.], seq 103670:105038, ack 526, win 506, options [nop,nop,TS val 1395313751 ecr 3652396350], length 1368
 00:00:00.133879 IP yali.mythic-beasts.com.https > mangole.dcs.gla.ac.uk.52088: Flags [.], seq 105038:106406, ack 526, win 506, options [nop,nop,TS val 1395313751 ecr 3652396350], length 1368
 00:00:00.133880 IP yali.mythic-beasts.com.https > mangole.dcs.gla.ac.uk.52088: Flags [.], seq 106406:107774, ack 526, win 506, options [nop,nop,TS val 1395313751 ecr 3652396350], length 1368
 00:00:00.133881 IP yali.mythic-beasts.com.https > mangole.dcs.gla.ac.uk.52088: Flags [.], seq 107774:109142, ack 526, win 506, options [nop,nop,TS val 1395313751 ecr 3652396350], length 1368
 00:00:00.133966 IP yali.mythic-beasts.com.https > mangole.dcs.gla.ac.uk.52088: Flags [.], seq 109142:110510, ack 526, win 506, options [nop,nop,TS val 1395313751 ecr 3652396350], length 1368
 00:00:00.133967 IP yali.mythic-beasts.com.https > mangole.dcs.gla.ac.uk.52088: Flags [.], seq 110510:111878, ack 526, win 506, options [nop,nop,TS val 1395313751 ecr 3652396350], length 1368
 00:00:00.134003 IP yali.mythic-beasts.com.https > mangole.dcs.gla.ac.uk.52088: Flags [P.], seq 111878:113246, ack 526, win 506, options [nop,nop,TS val 1395313751 ecr 3652396350], length 1368
 00:00:00.135653 IP yali.mythic-beasts.com.https > mangole.dcs.gla.ac.uk.52088: Flags [.], seq 113246:114614, ack 526, win 506, options [nop,nop,TS val 1395313753 ecr 3652396352], length 1368
 00:00:00.135951 IP yali.mythic-beasts.com.https > mangole.dcs.gla.ac.uk.52088: Flags [.], seq 114614:115982, ack 526, win 506, options [nop,nop,TS val 1395313753 ecr 3652396352], length 1368
 00:00:00.135954 IP yali.mythic-beasts.com.https > mangole.dcs.gla.ac.uk.52088: Flags [.], seq 115982:117350, ack 526, win 506, options [nop,nop,TS val 1395313753 ecr 3652396352], length 1368
 00:00:00.135955 IP yali.mythic-beasts.com.https > mangole.dcs.gla.ac.uk.52088: Flags [.], seq 117350:118718, ack 526, win 506, options [nop,nop,TS val 1395313753 ecr 3652396352], length 1368
 00:00:00.135956 IP yali.mythic-beasts.com.https > mangole.dcs.gla.ac.uk.52088: Flags [.], seq 118718:120086, ack 526, win 506, options [nop,nop,TS val 1395313753 ecr 3652396352], length 1368
 00:00:00.135956 IP yali.mythic-beasts.com.https > mangole.dcs.gla.ac.uk.52088: Flags [.], seq 120086:121454, ack 526, win 506, options [nop,nop,TS val 1395313753 ecr 3652396352], length 1368
 00:00:00.135957 IP yali.mythic-beasts.com.https > mangole.dcs.gla.ac.uk.52088: Flags [P.], seq 121454:122822, ack 526, win 506, options [nop,nop,TS val 1395313753 ecr 3652396352], length 1368
 00:00:00.135958 IP yali.mythic-beasts.com.https > mangole.dcs.gla.ac.uk.52088: Flags [.], seq 122822:124190, ack 526, win 506, options [nop,nop,TS val 1395313753 ecr 3652396352], length 1368
 00:00:00.135959 IP yali.mythic-beasts.com.https > mangole.dcs.gla.ac.uk.52088: Flags [.], seq 124190:125558, ack 526, win 506, options [nop,nop,TS val 1395313753 ecr 3652396352], length 1368
 00:00:00.135960 IP yali.mythic-beasts.com.https > mangole.dcs.gla.ac.uk.52088: Flags [.], seq 125558:126926, ack 526, win 506, options [nop,nop,TS val 1395313753 ecr 3652396352], length 1368
 00:00:00.135961 IP yali.mythic-beasts.com.https > mangole.dcs.gla.ac.uk.52088: Flags [.], seq 126926:128294, ack 526, win 506, options [nop,nop,TS val 1395313753 ecr 3652396352], length 1368
 00:00:00.135962 IP yali.mythic-beasts.com.https > mangole.dcs.gla.ac.uk.52088: Flags [.], seq 128294:129662, ack 526, win 506, options [nop,nop,TS val 1395313753 ecr 3652396352], length 1368
 00:00:00.135963 IP yali.mythic-beasts.com.https > mangole.dcs.gla.ac.uk.52088: Flags [.], seq 129662:131030, ack 526, win 506, options [nop,nop,TS val 1395313753 ecr 3652396352], length 1368
 00:00:00.135964 IP yali.mythic-beasts.com.https > mangole.dcs.gla.ac.uk.52088: Flags [P.], seq 131030:132398, ack 526, win 506, options [nop,nop,TS val 1395313753 ecr 3652396352], length 1368
 00:00:00.136273 IP yali.mythic-beasts.com.https > mangole.dcs.gla.ac.uk.52088: Flags [.], seq 132398:133766, ack 526, win 506, options [nop,nop,TS val 1395313754 ecr 3652396352], length 1368
 00:00:00.136274 IP yali.mythic-beasts.com.https > mangole.dcs.gla.ac.uk.52088: Flags [.], seq 133766:135134, ack 526, win 506, options [nop,nop,TS val 1395313754 ecr 3652396352], length 1368
 00:00:00.136275 IP yali.mythic-beasts.com.https > mangole.dcs.gla.ac.uk.52088: Flags [.], seq 135134:136502, ack 526, win 506, options [nop,nop,TS val 1395313754 ecr 3652396352], length 1368
 00:00:00.136276 IP yali.mythic-beasts.com.https > mangole.dcs.gla.ac.uk.52088: Flags [.], seq 136502:137870, ack 526, win 506, options [nop,nop,TS val 1395313754 ecr 3652396352], length 1368
 00:00:00.136277 IP yali.mythic-beasts.com.https > mangole.dcs.gla.ac.uk.52088: Flags [.], seq 137870:139238, ack 526, win 506, options [nop,nop,TS val 1395313754 ecr 3652396352], length 1368
 00:00:00.136278 IP yali.mythic-beasts.com.https > mangole.dcs.gla.ac.uk.52088: Flags [.], seq 139238:140606, ack 526, win 506, options [nop,nop,TS val 1395313754 ecr 3652396352], length 1368
 00:00:00.136278 IP yali.mythic-beasts.com.https > mangole.dcs.gla.ac.uk.52088: Flags [.], seq 140606:141974, ack 526, win 506, options [nop,nop,TS val 1395313754 ecr 3652396352], length 1368
 00:00:00.136279 IP yali.mythic-beasts.com.https > mangole.dcs.gla.ac.uk.52088: Flags [P.], seq 141974:143342, ack 526, win 506, options [nop,nop,TS val 1395313754 ecr 3652396352], length 1368
 00:00:00.136280 IP yali.mythic-beasts.com.https > mangole.dcs.gla.ac.uk.52088: Flags [.], seq 143342:144710, ack 526, win 506, options [nop,nop,TS val 1395313754 ecr 3652396352], length 1368
 00:00:00.136961 IP yali.mythic-beasts.com.https > mangole.dcs.gla.ac.uk.52088: Flags [.], seq 144710:146078, ack 526, win 506, options [nop,nop,TS val 1395313754 ecr 3652396352], length 1368
 00:00:00.137099 IP yali.mythic-beasts.com.https > mangole.dcs.gla.ac.uk.52088: Flags [.], seq 146078:147446, ack 526, win 506, options [nop,nop,TS val 1395313754 ecr 3652396352], length 1368
 00:00:00.137100 IP yali.mythic-beasts.com.https > mangole.dcs.gla.ac.uk.52088: Flags [.], seq 147446:148814, ack 526, win 506, options [nop,nop,TS val 1395313754 ecr 3652396352], length 1368
 00:00:00.137101 IP yali.mythic-beasts.com.https > mangole.dcs.gla.ac.uk.52088: Flags [.], seq 148814:150182, ack 526, win 506, options [nop,nop,TS val 1395313754 ecr 3652396352], length 1368
 00:00:00.137101 IP yali.mythic-beasts.com.https > mangole.dcs.gla.ac.uk.52088: Flags [.], seq 150182:151550, ack 526, win 506, options [nop,nop,TS val 1395313754 ecr 3652396352], length 1368
 00:00:00.137102 IP yali.mythic-beasts.com.https > mangole.dcs.gla.ac.uk.52088: Flags [.], seq 151550:152918, ack 526, win 506, options [nop,nop,TS val 1395313754 ecr 3652396352], length 1368
 00:00:00.137103 IP yali.mythic-beasts.com.https > mangole.dcs.gla.ac.uk.52088: Flags [.], seq 152918:154286, ack 526, win 506, options [nop,nop,TS val 1395313754 ecr 3652396352], length 1368
 00:00:00.137104 IP yali.mythic-beasts.com.https > mangole.dcs.gla.ac.uk.52088: Flags [P.], seq 154286:155654, ack 526, win 506, options [nop,nop,TS val 1395313754 ecr 3652396352], length 1368
 00:00:00.137105 IP yali.mythic-beasts.com.https > mangole.dcs.gla.ac.uk.52088: Flags [.], seq 155654:157022, ack 526, win 506, options [nop,nop,TS val 1395313754 ecr 3652396352], length 1368
 00:00:00.137106 IP yali.mythic-beasts.com.https > mangole.dcs.gla.ac.uk.52088: Flags [.], seq 157022:158390, ack 526, win 506, options [nop,nop,TS val 1395313754 ecr 3652396352], length 1368
 00:00:00.137107 IP yali.mythic-beasts.com.https > mangole.dcs.gla.ac.uk.52088: Flags [.], seq 158390:159758, ack 526, win 506, options [nop,nop,TS val 1395313754 ecr 3652396352], length 1368
 00:00:00.137108 IP yali.mythic-beasts.com.https > mangole.dcs.gla.ac.uk.52088: Flags [P.], seq 159758:161126, ack 526, win 506, options [nop,nop,TS val 1395313754 ecr 3652396352], length 1368
 00:00:00.137108 IP yali.mythic-beasts.com.https > mangole.dcs.gla.ac.uk.52088: Flags [.], seq 161126:162494, ack 526, win 506, options [nop,nop,TS val 1395313754 ecr 3652396352], length 1368
 00:00:00.137109 IP yali.mythic-beasts.com.https > mangole.dcs.gla.ac.uk.52088: Flags [.], seq 162494:163862, ack 526, win 506, options [nop,nop,TS val 1395313754 ecr 3652396352], length 1368
 00:00:00.137110 IP yali.mythic-beasts.com.https > mangole.dcs.gla.ac.uk.52088: Flags [.], seq 163862:165230, ack 526, win 506, options [nop,nop,TS val 1395313754 ecr 3652396352], length 1368
 00:00:00.137111 IP yali.mythic-beasts.com.https > mangole.dcs.gla.ac.uk.52088: Flags [.], seq 165230:166598, ack 526, win 506, options [nop,nop,TS val 1395313754 ecr 3652396352], length 1368
 00:00:00.137112 IP yali.mythic-beasts.com.https > mangole.dcs.gla.ac.uk.52088: Flags [.], seq 166598:167966, ack 526, win 506, options [nop,nop,TS val 1395313754 ecr 3652396352], length 1368
 00:00:00.137340 IP yali.mythic-beasts.com.https > mangole.dcs.gla.ac.uk.52088: Flags [.], seq 167966:169334, ack 526, win 506, options [nop,nop,TS val 1395313754 ecr 3652396352], length 1368
 00:00:00.137341 IP yali.mythic-beasts.com.https > mangole.dcs.gla.ac.uk.52088: Flags [.], seq 169334:170702, ack 526, win 506, options [nop,nop,TS val 1395313754 ecr 3652396352], length 1368
 00:00:00.137342 IP yali.mythic-beasts.com.https > mangole.dcs.gla.ac.uk.52088: Flags [.], seq 170702:172070, ack 526, win 506, options [nop,nop,TS val 1395313754 ecr 3652396352], length 1368
 00:00:00.137343 IP yali.mythic-beasts.com.https > mangole.dcs.gla.ac.uk.52088: Flags [P.], seq 172070:173438, ack 526, win 506, options [nop,nop,TS val 1395313754 ecr 3652396352], length 1368
 00:00:00.137344 IP yali.mythic-beasts.com.https > mangole.dcs.gla.ac.uk.52088: Flags [.], seq 173438:174806, ack 526, win 506, options [nop,nop,TS val 1395313754 ecr 3652396352], length 1368
 00:00:00.137345 IP yali.mythic-beasts.com.https > mangole.dcs.gla.ac.uk.52088: Flags [.], seq 174806:176174, ack 526, win 506, options [nop,nop,TS val 1395313754 ecr 3652396352], length 1368
 00:00:00.137346 IP yali.mythic-beasts.com.https > mangole.dcs.gla.ac.uk.52088: Flags [.], seq 176174:177542, ack 526, win 506, options [nop,nop,TS val 1395313754 ecr 3652396352], length 1368
 00:00:00.137347 IP yali.mythic-beasts.com.https > mangole.dcs.gla.ac.uk.52088: Flags [.], seq 177542:178910, ack 526, win 506, options [nop,nop,TS val 1395313754 ecr 3652396352], length 1368
 00:00:00.137347 IP yali.mythic-beasts.com.https > mangole.dcs.gla.ac.uk.52088: Flags [.], seq 178910:180278, ack 526, win 506, options [nop,nop,TS val 1395313754 ecr 3652396352], length 1368
 00:00:00.137348 IP yali.mythic-beasts.com.https > mangole.dcs.gla.ac.uk.52088: Flags [.], seq 180278:181646, ack 526, win 506, options [nop,nop,TS val 1395313754 ecr 3652396352], length 1368
 00:00:00.137349 IP yali.mythic-beasts.com.https > mangole.dcs.gla.ac.uk.52088: Flags [.], seq 181646:183014, ack 526, win 506, options [nop,nop,TS val 1395313754 ecr 3652396352], length 1368
 00:00:00.137350 IP yali.mythic-beasts.com.https > mangole.dcs.gla.ac.uk.52088: Flags [.], seq 183014:184382, ack 526, win 506, options [nop,nop,TS val 1395313754 ecr 3652396352], length 1368
 00:00:00.137351 IP yali.mythic-beasts.com.https > mangole.dcs.gla.ac.uk.52088: Flags [.], seq 184382:185750, ack 526, win 506, options [nop,nop,TS val 1395313754 ecr 3652396352], length 1368
 00:00:00.137352 IP yali.mythic-beasts.com.https > mangole.dcs.gla.ac.uk.52088: Flags [P.], seq 185750:187118, ack 526, win 506, options [nop,nop,TS val 1395313754 ecr 3652396352], length 1368
 00:00:00.137353 IP yali.mythic-beasts.com.https > mangole.dcs.gla.ac.uk.52088: Flags [.], seq 187118:188486, ack 526, win 506, options [nop,nop,TS val 1395313754 ecr 3652396353], length 1368
 00:00:00.137354 IP yali.mythic-beasts.com.https > mangole.dcs.gla.ac.uk.52088: Flags [.], seq 188486:189854, ack 526, win 506, options [nop,nop,TS val 1395313754 ecr 3652396353], length 1368
 00:00:00.137452 IP yali.mythic-beasts.com.https > mangole.dcs.gla.ac.uk.52088: Flags [.], seq 189854:191222, ack 526, win 506, options [nop,nop,TS val 1395313754 ecr 3652396353], length 1368
 00:00:00.137453 IP yali.mythic-beasts.com.https > mangole.dcs.gla.ac.uk.52088: Flags [.], seq 191222:192590, ack 526, win 506, options [nop,nop,TS val 1395313754 ecr 3652396353], length 1368
 00:00:00.137454 IP yali.mythic-beasts.com.https > mangole.dcs.gla.ac.uk.52088: Flags [.], seq 192590:193958, ack 526, win 506, options [nop,nop,TS val 1395313754 ecr 3652396353], length 1368
 00:00:00.137455 IP yali.mythic-beasts.com.https > mangole.dcs.gla.ac.uk.52088: Flags [.], seq 193958:195326, ack 526, win 506, options [nop,nop,TS val 1395313754 ecr 3652396353], length 1368
 00:00:00.137456 IP yali.mythic-beasts.com.https > mangole.dcs.gla.ac.uk.52088: Flags [.], seq 195326:196694, ack 526, win 506, options [nop,nop,TS val 1395313754 ecr 3652396353], length 1368
 00:00:00.137457 IP yali.mythic-beasts.com.https > mangole.dcs.gla.ac.uk.52088: Flags [.], seq 196694:198062, ack 526, win 506, options [nop,nop,TS val 1395313754 ecr 3652396353], length 1368
 00:00:00.137458 IP yali.mythic-beasts.com.https > mangole.dcs.gla.ac.uk.52088: Flags [.], seq 198062:199430, ack 526, win 506, options [nop,nop,TS val 1395313754 ecr 3652396353], length 1368
 00:00:00.137458 IP yali.mythic-beasts.com.https > mangole.dcs.gla.ac.uk.52088: Flags [P.], seq 199430:200798, ack 526, win 506, options [nop,nop,TS val 1395313754 ecr 3652396353], length 1368
 00:00:00.137459 IP yali.mythic-beasts.com.https > mangole.dcs.gla.ac.uk.52088: Flags [.], seq 200798:202166, ack 526, win 506, options [nop,nop,TS val 1395313754 ecr 3652396353], length 1368
 00:00:00.137460 IP yali.mythic-beasts.com.https > mangole.dcs.gla.ac.uk.52088: Flags [.], seq 202166:203534, ack 526, win 506, options [nop,nop,TS val 1395313754 ecr 3652396353], length 1368
 00:00:00.137461 IP yali.mythic-beasts.com.https > mangole.dcs.gla.ac.uk.52088: Flags [.], seq 203534:204902, ack 526, win 506, options [nop,nop,TS val 1395313754 ecr 3652396353], length 1368
 00:00:00.137462 IP yali.mythic-beasts.com.https > mangole.dcs.gla.ac.uk.52088: Flags [P.], seq 204902:206270, ack 526, win 506, options [nop,nop,TS val 1395313754 ecr 3652396353], length 1368
 00:00:00.147497 IP yali.mythic-beasts.com.https > mangole.dcs.gla.ac.uk.52088: Flags [.], seq 206270:207638, ack 526, win 506, options [nop,nop,TS val 1395313765 ecr 3652396364], length 1368
 00:00:00.147571 IP yali.mythic-beasts.com.https > mangole.dcs.gla.ac.uk.52088: Flags [.], seq 207638:209006, ack 526, win 506, options [nop,nop,TS val 1395313765 ecr 3652396364], length 1368
 00:00:00.147572 IP yali.mythic-beasts.com.https > mangole.dcs.gla.ac.uk.52088: Flags [.], seq 209006:210374, ack 526, win 506, options [nop,nop,TS val 1395313765 ecr 3652396364], length 1368
 00:00:00.147573 IP yali.mythic-beasts.com.https > mangole.dcs.gla.ac.uk.52088: Flags [.], seq 210374:211742, ack 526, win 506, options [nop,nop,TS val 1395313765 ecr 3652396364], length 1368
 00:00:00.147574 IP yali.mythic-beasts.com.https > mangole.dcs.gla.ac.uk.52088: Flags [.], seq 211742:213110, ack 526, win 506, options [nop,nop,TS val 1395313765 ecr 3652396364], length 1368
 00:00:00.147576 IP yali.mythic-beasts.com.https > mangole.dcs.gla.ac.uk.52088: Flags [.], seq 213110:214478, ack 526, win 506, options [nop,nop,TS val 1395313765 ecr 3652396364], length 1368
 00:00:00.147577 IP yali.mythic-beasts.com.https > mangole.dcs.gla.ac.uk.52088: Flags [.], seq 214478:215846, ack 526, win 506, options [nop,nop,TS val 1395313765 ecr 3652396364], length 1368
 00:00:00.147578 IP yali.mythic-beasts.com.https > mangole.dcs.gla.ac.uk.52088: Flags [.], seq 215846:217214, ack 526, win 506, options [nop,nop,TS val 1395313765 ecr 3652396364], length 1368
 00:00:00.147580 IP yali.mythic-beasts.com.https > mangole.dcs.gla.ac.uk.52088: Flags [.], seq 217214:218582, ack 526, win 506, options [nop,nop,TS val 1395313765 ecr 3652396364], length 1368
 00:00:00.147581 IP yali.mythic-beasts.com.https > mangole.dcs.gla.ac.uk.52088: Flags [.], seq 218582:219950, ack 526, win 506, options [nop,nop,TS val 1395313765 ecr 3652396364], length 1368
 00:00:00.147582 IP yali.mythic-beasts.com.https > mangole.dcs.gla.ac.uk.52088: Flags [.], seq 219950:221318, ack 526, win 506, options [nop,nop,TS val 1395313765 ecr 3652396364], length 1368
 00:00:00.147583 IP yali.mythic-beasts.com.https > mangole.dcs.gla.ac.uk.52088: Flags [P.], seq 221318:222686, ack 526, win 506, options [nop,nop,TS val 1395313765 ecr 3652396364], length 1368
 00:00:00.147584 IP yali.mythic-beasts.com.https > mangole.dcs.gla.ac.uk.52088: Flags [.], seq 222686:224054, ack 526, win 506, options [nop,nop,TS val 1395313765 ecr 3652396364], length 1368
 00:00:00.147606 IP yali.mythic-beasts.com.https > mangole.dcs.gla.ac.uk.52088: Flags [P.], seq 224054:225422, ack 526, win 506, options [nop,nop,TS val 1395313765 ecr 3652396364], length 1368
 00:00:00.150486 IP yali.mythic-beasts.com.https > mangole.dcs.gla.ac.uk.52088: Flags [.], seq 225422:226790, ack 526, win 506, options [nop,nop,TS val 1395313768 ecr 3652396366], length 1368
 00:00:00.150488 IP yali.mythic-beasts.com.https > mangole.dcs.gla.ac.uk.52088: Flags [.], seq 226790:228158, ack 526, win 506, options [nop,nop,TS val 1395313768 ecr 3652396366], length 1368
 00:00:00.150489 IP yali.mythic-beasts.com.https > mangole.dcs.gla.ac.uk.52088: Flags [.], seq 228158:229526, ack 526, win 506, options [nop,nop,TS val 1395313768 ecr 3652396366], length 1368
 00:00:00.150489 IP yali.mythic-beasts.com.https > mangole.dcs.gla.ac.uk.52088: Flags [.], seq 229526:230894, ack 526, win 506, options [nop,nop,TS val 1395313768 ecr 3652396366], length 1368
 00:00:00.150490 IP yali.mythic-beasts.com.https > mangole.dcs.gla.ac.uk.52088: Flags [.], seq 230894:232262, ack 526, win 506, options [nop,nop,TS val 1395313768 ecr 3652396366], length 1368
 00:00:00.150492 IP yali.mythic-beasts.com.https > mangole.dcs.gla.ac.uk.52088: Flags [.], seq 232262:233630, ack 526, win 506, options [nop,nop,TS val 1395313768 ecr 3652396366], length 1368
 00:00:00.150493 IP yali.mythic-beasts.com.https > mangole.dcs.gla.ac.uk.52088: Flags [.], seq 233630:234998, ack 526, win 506, options [nop,nop,TS val 1395313768 ecr 3652396366], length 1368
 00:00:00.150494 IP yali.mythic-beasts.com.https > mangole.dcs.gla.ac.uk.52088: Flags [.], seq 234998:236366, ack 526, win 506, options [nop,nop,TS val 1395313768 ecr 3652396366], length 1368
 00:00:00.150495 IP yali.mythic-beasts.com.https > mangole.dcs.gla.ac.uk.52088: Flags [.], seq 236366:237734, ack 526, win 506, options [nop,nop,TS val 1395313768 ecr 3652396366], length 1368
 00:00:00.150496 IP yali.mythic-beasts.com.https > mangole.dcs.gla.ac.uk.52088: Flags [.], seq 237734:239102, ack 526, win 506, options [nop,nop,TS val 1395313768 ecr 3652396366], length 1368
 00:00:00.150496 IP yali.mythic-beasts.com.https > mangole.dcs.gla.ac.uk.52088: Flags [.], seq 239102:240470, ack 526, win 506, options [nop,nop,TS val 1395313768 ecr 3652396366], length 1368
 00:00:00.150497 IP yali.mythic-beasts.com.https > mangole.dcs.gla.ac.uk.52088: Flags [.], seq 240470:241838, ack 526, win 506, options [nop,nop,TS val 1395313768 ecr 3652396366], length 1368
 00:00:00.150498 IP yali.mythic-beasts.com.https > mangole.dcs.gla.ac.uk.52088: Flags [.], seq 241838:243206, ack 526, win 506, options [nop,nop,TS val 1395313768 ecr 3652396366], length 1368
 00:00:00.150499 IP yali.mythic-beasts.com.https > mangole.dcs.gla.ac.uk.52088: Flags [.], seq 243206:244574, ack 526, win 506, options [nop,nop,TS val 1395313768 ecr 3652396366], length 1368
 00:00:00.150860 IP yali.mythic-beasts.com.https > mangole.dcs.gla.ac.uk.52088: Flags [P.], seq 244574:245942, ack 526, win 506, options [nop,nop,TS val 1395313768 ecr 3652396366], length 1368
 00:00:00.150861 IP yali.mythic-beasts.com.https > mangole.dcs.gla.ac.uk.52088: Flags [.], seq 245942:247310, ack 526, win 506, options [nop,nop,TS val 1395313768 ecr 3652396366], length 1368
 00:00:00.150861 IP yali.mythic-beasts.com.https > mangole.dcs.gla.ac.uk.52088: Flags [.], seq 247310:248678, ack 526, win 506, options [nop,nop,TS val 1395313768 ecr 3652396366], length 1368
 00:00:00.151240 IP yali.mythic-beasts.com.https > mangole.dcs.gla.ac.uk.52088: Flags [.], seq 248678:250046, ack 526, win 506, options [nop,nop,TS val 1395313768 ecr 3652396366], length 1368
 00:00:00.151241 IP yali.mythic-beasts.com.https > mangole.dcs.gla.ac.uk.52088: Flags [.], seq 250046:251414, ack 526, win 506, options [nop,nop,TS val 1395313768 ecr 3652396366], length 1368
 00:00:00.151242 IP yali.mythic-beasts.com.https > mangole.dcs.gla.ac.uk.52088: Flags [.], seq 251414:252782, ack 526, win 506, options [nop,nop,TS val 1395313768 ecr 3652396366], length 1368
 00:00:00.151244 IP yali.mythic-beasts.com.https > mangole.dcs.gla.ac.uk.52088: Flags [.], seq 252782:254150, ack 526, win 506, options [nop,nop,TS val 1395313768 ecr 3652396366], length 1368
 00:00:00.151244 IP yali.mythic-beasts.com.https > mangole.dcs.gla.ac.uk.52088: Flags [.], seq 254150:255518, ack 526, win 506, options [nop,nop,TS val 1395313768 ecr 3652396366], length 1368
 00:00:00.151245 IP yali.mythic-beasts.com.https > mangole.dcs.gla.ac.uk.52088: Flags [.], seq 255518:256886, ack 526, win 506, options [nop,nop,TS val 1395313768 ecr 3652396366], length 1368
 00:00:00.151246 IP yali.mythic-beasts.com.https > mangole.dcs.gla.ac.uk.52088: Flags [.], seq 256886:258254, ack 526, win 506, options [nop,nop,TS val 1395313768 ecr 3652396366], length 1368
 00:00:00.151247 IP yali.mythic-beasts.com.https > mangole.dcs.gla.ac.uk.52088: Flags [.], seq 258254:259622, ack 526, win 506, options [nop,nop,TS val 1395313768 ecr 3652396366], length 1368
 00:00:00.151248 IP yali.mythic-beasts.com.https > mangole.dcs.gla.ac.uk.52088: Flags [.], seq 259622:260990, ack 526, win 506, options [nop,nop,TS val 1395313768 ecr 3652396366], length 1368
 00:00:00.151249 IP yali.mythic-beasts.com.https > mangole.dcs.gla.ac.uk.52088: Flags [.], seq 260990:262358, ack 526, win 506, options [nop,nop,TS val 1395313768 ecr 3652396366], length 1368
 00:00:00.151249 IP yali.mythic-beasts.com.https > mangole.dcs.gla.ac.uk.52088: Flags [.], seq 262358:263726, ack 526, win 506, options [nop,nop,TS val 1395313768 ecr 3652396366], length 1368
 00:00:00.151250 IP yali.mythic-beasts.com.https > mangole.dcs.gla.ac.uk.52088: Flags [.], seq 263726:265094, ack 526, win 506, options [nop,nop,TS val 1395313768 ecr 3652396366], length 1368
 00:00:00.151251 IP yali.mythic-beasts.com.https > mangole.dcs.gla.ac.uk.52088: Flags [P.], seq 265094:266462, ack 526, win 506, options [nop,nop,TS val 1395313768 ecr 3652396366], length 1368
 00:00:00.151252 IP yali.mythic-beasts.com.https > mangole.dcs.gla.ac.uk.52088: Flags [.], seq 266462:267830, ack 526, win 506, options [nop,nop,TS val 1395313768 ecr 3652396366], length 1368
 00:00:00.151253 IP yali.mythic-beasts.com.https > mangole.dcs.gla.ac.uk.52088: Flags [.], seq 267830:269198, ack 526, win 506, options [nop,nop,TS val 1395313768 ecr 3652396366], length 1368
 00:00:00.151254 IP yali.mythic-beasts.com.https > mangole.dcs.gla.ac.uk.52088: Flags [.], seq 269198:270566, ack 526, win 506, options [nop,nop,TS val 1395313768 ecr 3652396366], length 1368
 00:00:00.151574 IP yali.mythic-beasts.com.https > mangole.dcs.gla.ac.uk.52088: Flags [.], seq 270566:271934, ack 526, win 506, options [nop,nop,TS val 1395313768 ecr 3652396366], length 1368
 00:00:00.151575 IP yali.mythic-beasts.com.https > mangole.dcs.gla.ac.uk.52088: Flags [.], seq 271934:273302, ack 526, win 506, options [nop,nop,TS val 1395313768 ecr 3652396366], length 1368
 00:00:00.151576 IP yali.mythic-beasts.com.https > mangole.dcs.gla.ac.uk.52088: Flags [.], seq 273302:274670, ack 526, win 506, options [nop,nop,TS val 1395313768 ecr 3652396366], length 1368
 00:00:00.151577 IP yali.mythic-beasts.com.https > mangole.dcs.gla.ac.uk.52088: Flags [.], seq 274670:276038, ack 526, win 506, options [nop,nop,TS val 1395313768 ecr 3652396366], length 1368
 00:00:00.151902 IP yali.mythic-beasts.com.https > mangole.dcs.gla.ac.uk.52088: Flags [.], seq 276038:277406, ack 526, win 506, options [nop,nop,TS val 1395313768 ecr 3652396366], length 1368
 00:00:00.151904 IP yali.mythic-beasts.com.https > mangole.dcs.gla.ac.uk.52088: Flags [.], seq 277406:278774, ack 526, win 506, options [nop,nop,TS val 1395313768 ecr 3652396366], length 1368
 00:00:00.151905 IP yali.mythic-beasts.com.https > mangole.dcs.gla.ac.uk.52088: Flags [.], seq 278774:280142, ack 526, win 506, options [nop,nop,TS val 1395313768 ecr 3652396366], length 1368
 00:00:00.152136 IP yali.mythic-beasts.com.https > mangole.dcs.gla.ac.uk.52088: Flags [.], seq 280142:281510, ack 526, win 506, options [nop,nop,TS val 1395313768 ecr 3652396366], length 1368
